{
  "version": 1,
  "layout": "rdkit",
  "alignPair": true,
  "atomNumbers": true,
  "createdDestroyed": true,
  "modified": true,
  "style": "rdkit",
  "circles": "filled",
  "circleRadius": 0.42,
  "circleStroke": 1.5,
  "boundary": true,
  "hydrogens": "show",
  "elementColors": "mono",
  "numScale": 0.51,
  "labelScale": 0.74,
  "bondWidth": 1.6,
  "markWidth": 1.7,
  "haloWidth": 5,
  "haloOpacity": 0.3,
  "destroyedColor": "#d62828",
  "createdColor": "#d62828",
  "modifiedColor": "#015ab5",
  "stereo": false,
  "customSpec": "",
  "customColor": "#7c3aed"
}
